"icon","set_id","lang","name","desc"
UI_RelicIcon_10013_4,10013,zh,游医的银莲,是珍贵的药材，但存放了这么久已经失去了药用价值。
UI_RelicIcon_10013_5,10013,zh,游医的怀钟,用来精确计时的道具。对医者而言，即使是一秒的时间也不能浪费。
UI_RelicIcon_10013_1,10013,en,Traveling Doctor's Medicine Pot,"This pot used to carry concentrated and extremely potent concoctions. It is now empty, but still gives off a strong smell of medicine."
UI_RelicIcon_10013_2,10013,en,Traveling Doctor's Owl Feather,"The durable feather of an owl. Emblematic of nocturnal supremacy, it gave some encouragement to the Traveling Doctor when venturing out to visit patients late at night."
UI_RelicIcon_10013_3,10013,en,Traveling Doctor's Handkerchief,Used to tie back the doctor's hair when treating patients. Can also be used as a sling for sprains and broken arms in emergencies.
UI_RelicIcon_10013_4,10013,en,Traveling Doctor's Silver Lotus,A precious medicinal ingredient that has lost all medicinal value after years in storage.
UI_RelicIcon_10013_5,10013,en,Traveling Doctor's Pocket Watch,"A precise instrument used for keeping time. For a doctor, every second counts."
UI_RelicIcon_10013_1,10013,ja,医者の薬壺,精錬後の薬でいっぱいだった壺も、今は濃い薬のにおいしか残っていない。
UI_RelicIcon_10013_2,10013,ja,医者の梟の羽根,夜行性猛禽の硬い羽根。夜に仕事する時はそれを見て自分を励ます。
UI_RelicIcon_10013_3,10013,ja,医者の方巾,普段は乱れた髪を束ねる。緊急時は捻挫、骨折した腕の固定にも使える。
UI_RelicIcon_10013_4,10013,ja,医者のアネモネ,貴重な薬材だったが、長い間放置されて薬としての価値を失った。
UI_RelicIcon_10013_5,10013,ja,医者の懐中時計,時間を測るための道具。医者は、1秒でも無駄にしたくない。
UI_RelicIcon_10013_1,10013,ko,떠돌이 의사의 약주전자,"원래는 정제된 약으로 가득 차 있었는데, 지금은 강한 약 냄새만 남아있다"
UI_RelicIcon_10013_2,10013,ko,떠돌이 의사의 올빼미깃,올빼미의 단단한 깃털. 야간 진료하러 갈 때 야행성 맹금을 떠올리며 자신을 격려한다
UI_RelicIcon_10013_3,10013,ko,떠돌이 의사의 두건,"평소에는 진료할 때 헝클어진 머리를 묶을 수 있고, 유사시에는 접질리고 부러진 팔을 받치는 데 사용할 수도 있다"
UI_RelicIcon_10013_4,10013,ko,떠돌이 의사의 은련,진귀한 약재. 하지만 시간이 너무 오래 지나 약용 가치가 사라졌다
UI_RelicIcon_10013_5,10013,ko,떠돌이 의사의 회중시계,정확한 시간을 재기 위한 도구. 의사한테는 1초도 소중하다
UI_RelicIcon_15036_1,15036,zh,筹谋的共樽,陶制的三足杯，曾有诸多英雄在篝火边举杯酣饮，谈论各自的野心与期冀。
UI_RelicIcon_15036_2,15036,zh,褪光的翠尾,已褪去华光的尾翎装饰，其上的纹路据说出自久远之前的巧匠之手。
UI_RelicIcon_15036_3,15036,zh,失冕的宝冠,由松石与翠羽装饰的黄金宝冠，但空居绒垫之上，从未出现在冕礼之中。
UI_RelicIcon_15036_4,15036,zh,暗结的明花,由灰石雕刻并巧贴金箔的花，传说在一场战争中，曾作为敌我双方区别的凭证。
UI_RelicIcon_15036_5,15036,zh,举业的识刻,古老国度计时的历晷，在某一刻度上，留有仔细观察才可看到的细小印记。
UI_RelicIcon_15036_1,15036,en,The Wine-Flask Over Which the Plan Was Hatched,"A three-legged cup. Once, many heroes were gathered around the bonfire, raising their cups high in toast and drinking their fill while discussing their wishes and ambitions."
UI_RelicIcon_15036_2,15036,en,Faded Emerald Tail,A tail feather ornament whose luster has long faded. The patterns on it are said to have been etched by the hand of a skilled artisan from long ago.
UI_RelicIcon_15036_3,15036,en,Crownless Crown,"A golden crown decorated with turquoise and emerald feathers, it has never been used in a coronation, living alone atop a velvet cushion."
UI_RelicIcon_15036_4,15036,en,Dark Fruit of Bright Flowers,"A flower carved from grey stone covered with gold foil. Legends say that during a war, it was used to differentiate friend from foe."
UI_RelicIcon_15036_5,15036,en,Moment of Attainment,A sundial used by an ancient kingdom to tell time. Tiny marks have been left at a certain scale that can only be seen through careful observation.
UI_RelicIcon_15036_1,15036,ja,計略の盃,陶器の三足杯。かつては多くの英雄が篝火のそばで杯を掲げ、各々の野望と願いを語った。
UI_RelicIcon_15036_2,15036,ja,光褪せた翠尾,輝きの褪せた尾羽の飾り。表面の模様は遥か昔の職人が手掛けたものらしい。
UI_RelicIcon_15036_3,15036,ja,主なき冠,ターコイズとエメラルドで飾られた黄金の宝冠。ベルベットのクッションの上に置かれるのみで、戴冠式に登場したことは一度もない。
UI_RelicIcon_15036_4,15036,ja,陰に咲く光の花,灰色の石に彫刻され、巧みに金箔を貼られた花。ある戦争では、敵味方の区別の証として使われていたという。
UI_RelicIcon_15036_5,15036,ja,大業を成す刻,古の国が時間を測るために使った日時計。目盛りの一つには、細かく観察しないと見えない小さな印が残されている。
UI_RelicIcon_15036_1,15036,ko,공모의 술잔,도자기 재질의 세 발 술잔. 과거 수많은 영웅들이 모닥불 옆에서 이 술잔을 기울이며 각자의 야망과 희망을 이야기했다
UI_RelicIcon_15036_2,15036,ko,빛바랜 푸른 꽁지,화려한 빛을 잃어버린 꽁지깃 장식. 장식 위의 무늬는 먼 옛날 장인의 손에서 탄생했다고 한다
UI_RelicIcon_15036_3,15036,ko,주인 잃은 왕관,"터키석과 옥빛 깃털로 장식된 황금 왕관. 하지만 지금까지 오로지 벨벳 쿠션 위에만 놓여있었을 뿐, 대관식에 등장한 적은 없다"
UI_RelicIcon_15036_4,15036,ko,어둠 속의 밝은 꽃,회색빛 돌로 조각하고 금박을 붙여 만든 꽃. 과거에 전쟁에서 적과 아군을 구별하는 증거로 사용되었다고 전해진다
UI_RelicIcon_15036_5,15036,ko,대업의 시간,고대 왕국에서 시간을 확인하기 위해 사용했던 해시계. 눈금에는 세심하게 관찰해야만 확인할 수 있는 작은 표시가 남겨져 있다
UI_RelicIcon_14002_1,14002,zh,平雷之器,平雷勇士的酒盏，据说平息了雷之魔兽的英雄曾用这尊酒盏满盛紫电为饮。
UI_RelicIcon_14002_2,14002,zh,平雷之羽,在传说中，挺身平息了雷电的勇武英雄的徽章，是翱翔于狂雷的猛禽之羽。
UI_RelicIcon_14002_3,14002,zh,平雷之冠,平雷勇士的冠冕，是古老的英雄击败了危害大地的雷之魔兽而获得的华冠。
UI_RelicIcon_14002_4,14002,zh,平雷之心,仅于雷霆之怒中傲然盛放的花朵，至今仍能赐予行走在雷雨中的游人勇气。
UI_RelicIcon_14002_5,14002,zh,平雷之刻,镇服雷电的勇士持有的时计，其中的雷之碎晶随流逝如雷如电的时间泻落。
UI_RelicIcon_14002_1,14002,en,Thundersoother's Goblet,"The wine goblet from which the Thundersoother, who defeated the Beast of Thunder, once drank violet lightning."
UI_RelicIcon_14002_2,14002,en,Thundersoother's Plume,The feather of a predatory bird that soars through lightning storms. It was said to have been adopted as an insignia by the legendary hero who pacified thunder and lightning.
UI_RelicIcon_14002_3,14002,en,Thundersoother's Diadem,The crown given to the Thundersoother for defeating the Beast of Thunder that had been wreaking havoc upon the land.
UI_RelicIcon_14002_4,14002,en,Thundersoother's Heart,"A flower that blooms even amidst ferocious thunder and lightning. To this day, it still grants courage to travelers in thunderstorms."
UI_RelicIcon_14002_5,14002,en,Hour of Soothing Thunder,A timepiece kept by the hero who conquered thunder and lightning. The tiny shards of Electro crystal within flow back and forth with the passing of time.
UI_RelicIcon_14002_1,14002,ja,雷討ちの器,雷討ちの勇士の盃。雷の魔獣を退治した英雄がこの盃を使って紫電を飲んだらしい。
UI_RelicIcon_14002_2,14002,ja,雷討ちの羽根,伝説によると、雷電を退治した英雄が使用していたバッジ、狂雷の中を飛ぶ猛禽の羽根でできたらしい。
UI_RelicIcon_14002_3,14002,ja,雷討ちの冠,雷討ちの勇士の冠、古き英雄が大地に害をなす雷の魔獣を倒して獲得した冠である。
UI_RelicIcon_14002_4,14002,ja,雷討ちの心,雷霆の中に咲き誇る花、今でも雷雨の中を行く人々に勇気を与える。
UI_RelicIcon_14002_5,14002,ja,雷討ちの刻,雷電を退治した勇士が使用していた時計、中の雷の結晶は雷電のように過ぎていく時間と共に落ちていく。
UI_RelicIcon_14002_1,14002,ko,뇌전 정복자의 술잔,뇌전 정복자의 술잔. 뇌전의 마수를 정복한 영웅이 이 잔에 자줏빛 번개를 가득 채워 마셨다고 전해진다
UI_RelicIcon_14002_2,14002,ko,뇌전 정복자의 깃털,번개를 제압한 영웅의 배지. 광뢰가 몰아치는 하늘을 활공하는 맹금의 깃털이다
UI_RelicIcon_14002_3,14002,ko,뇌전 정복자의 관,뇌전 정복자의 관면. 고대의 영웅이 지상을 위협하는 뇌전의 마수를 처치하고 얻은 관면이다
UI_RelicIcon_14002_4,14002,ko,뇌전 정복자의 마음,천둥번개가 내려치는 날에만 활짝 피는 꽃. 오늘날에도 소나기를 헤쳐나가는 여행자에게 용기를 북돋아 준다
UI_RelicIcon_14002_5,14002,ko,뇌전 정복자의 시계,뇌전을 정복한 용사가 지닌 시계. 안속의 번개의 결정이 천둥 번개처럼 빨리 흘러가는 시간같이 쏟아진다
UI_RelicIcon_15035_1,15035,zh,灵露倾洒的狂诗,使用铜胎为底烧制的来通杯，过去曾灌满乐园的美酒。
UI_RelicIcon_15035_2,15035,zh,古海玄幽的夜想,模仿传说中的金蜂翅翼雕琢而成的羽饰，似乎会随着微风震颤。
UI_RelicIcon_15035_3,15035,zh,异想零落的圆舞,曾经覆以金箔的面具，或许是古时统帅军团之人的遗物。
UI_RelicIcon_15035_4,15035,zh,谐律交响的前奏,以黄金与青石点缀的怒放之花，曾是赐予不朽之人的荣章。
UI_RelicIcon_15035_5,15035,zh,命途轮转的谐谑,仿照命运之轮的样子打造的时计，如今早已无法转动。
UI_RelicIcon_15035_1,15035,en,Ichor Shower Rhapsody,"A rhyton fired with copper as the base, that was once filled with fine wine from paradise."
UI_RelicIcon_15035_2,15035,en,Ancient Sea's Nocturnal Musing,A feather accessory carved in the shape of the wings of the golden bees of legend. They seem to flutter with the slightest breeze.
UI_RelicIcon_15035_3,15035,en,Whimsical Dance of the Withered,A mask once covered in gold leaf. Perhaps it is a relic from some ancient officer of the legions.
UI_RelicIcon_15035_4,15035,en,Harmonious Symphony Prelude,"An honorary medal in the shape of a blooming flower. Adorned with blue stone and gold, it was once bestowed upon immortals."
UI_RelicIcon_15035_5,15035,en,The Grand Jape of the Turning of Fate,A timepiece made in imitation of the wheel of fate. It ceased turning long ago.
UI_RelicIcon_15035_1,15035,ja,降り注ぐイコルの狂詩,銅をベースにして焼き上げられたリュトン。かつては楽園の美酒で満たされていた。
UI_RelicIcon_15035_2,15035,ja,古海の幽深なる夜想,伝説の金の蜂の羽根を真似て作られた羽飾り。そよ風に吹かれて微かに震える。
UI_RelicIcon_15035_3,15035,ja,異想が枯れ落ちる円舞,かつては金箔で覆われていた仮面。古代、軍団を率いていた人物の遺物かもしれない。
UI_RelicIcon_15035_4,15035,ja,響き合う諧律の前奏,黄金と青き石で飾られた咲き誇る花。かつて、不滅の者に与えられた栄章であった。
UI_RelicIcon_15035_5,15035,ja,運命と輪廻の諧謔,運命の輪を模して作られた時計。今はもう回せなくなっている。
UI_RelicIcon_15035_1,15035,ko,영혼 이슬의 광시곡,"구리를 바탕으로 구워서 제작한 뿔잔, 한때는 낙원의 술이 그 안을 가득 채우고 있었다"
UI_RelicIcon_15035_2,15035,ko,고대 바다의 야상곡,전설 속 황금 벌의 날개를 따라 조각해 만든 깃털 장식. 마치 산들바람에 흔들거리는 것 같다
UI_RelicIcon_15035_3,15035,ko,영락한 공상의 왈츠,원래는 금박으로 덮여 있던 가면. 어쩌면 고대에 군단을 이끌었던 자가 남긴 물건일지도 모른다
UI_RelicIcon_15035_4,15035,ko,조화로운 전주곡,황금과 푸른 돌로 장식된 만개한 꽃. 과거에는 불멸자에게 주어졌던 영예의 상징이었다
UI_RelicIcon_15035_5,15035,ko,구르는 운명의 해학곡,운명의 수레바퀴를 본떠 만든 시계. 이미 오래전에 움직임을 멈췄다
UI_RelicIcon_15008_1,15008,zh,染血骑士之杯,辛焱专用
UI_RelicIcon_15008_2,15008,zh,染血的黑之羽,辛焱专用
UI_RelicIcon_15008_3,15008,zh,染血的铁假面,辛焱专用
UI_RelicIcon_15008_4,15008,zh,染血的铁之心,辛焱专用
UI_RelicIcon_15008_5,15008,zh,骑士染血之时,辛焱专用
UI_RelicIcon_15008_1,15008,en,Bloodstained Chevalier's Goblet,""
UI_RelicIcon_15008_2,15008,en,Bloodstained Black Plume,""
UI_RelicIcon_15008_3,15008,en,Bloodstained Iron Mask,""
UI_RelicIcon_15008_4,15008,en,Bloodstained Flower of Iron,""
UI_RelicIcon_15008_5,15008,en,Bloodstained Final Hour,""
UI_RelicIcon_15008_1,15008,ja,血染めの騎士のコップ,""
UI_RelicIcon_15008_2,15008,ja,血染めの黒羽,""
UI_RelicIcon_15008_3,15008,ja,血染めの鉄仮面,""
UI_RelicIcon_15008_4,15008,ja,血染めの鉄の心,""
UI_RelicIcon_15008_5,15008,ja,騎士が血に染めた時,""
UI_RelicIcon_15008_1,15008,ko,피에 물든 기사의 술잔,""
UI_RelicIcon_15008_2,15008,ko,피에 물든 검은 깃털,""
UI_RelicIcon_15008_3,15008,ko,피에 물든 철가면,""
UI_RelicIcon_15008_4,15008,ko,피에 물든 강철 심장,""
UI_RelicIcon_15008_5,15008,ko,피에 물든 기사의 시계,""
UI_RelicIcon_15019_1,15019,zh,祈望之心,待定
UI_RelicIcon_15019_2,15019,zh,思忆之矢,待定
UI_RelicIcon_15019_3,15019,zh,无常之面,待定
UI_RelicIcon_15019_4,15019,zh,羁缠之花,待定
UI_RelicIcon_15019_5,15019,zh,朝露之时,待定
UI_RelicIcon_15019_1,15019,en,Hopeful Heart,""
UI_RelicIcon_15019_2,15019,en,Shaft of Remembrance,""
UI_RelicIcon_15019_3,15019,en,Capricious Visage,""
UI_RelicIcon_15019_4,15019,en,Entangling Bloom,""
UI_RelicIcon_15019_5,15019,en,Morning Dew's Moment,""
UI_RelicIcon_15019_1,15019,ja,祈望の心,""
UI_RelicIcon_15019_2,15019,ja,憶念の矢,""
UI_RelicIcon_15019_3,15019,ja,無常の面,""
UI_RelicIcon_15019_4,15019,ja,羈絆の花,""
UI_RelicIcon_15019_5,15019,ja,朝露の時,""
UI_RelicIcon_15019_1,15019,ko,기도하는 마음,""
UI_RelicIcon_15019_2,15019,ko,회상의 화살,""
UI_RelicIcon_15019_3,15019,ko,무상의 가면,""
UI_RelicIcon_15019_4,15019,ko,속박의 꽃,""
UI_RelicIcon_15019_5,15019,ko,아침 이슬의 시간,""
UI_RelicIcon_15009_3,15009,zh,祭火礼冠,在古老的时代，司祭祀之人佩戴的礼冠。因为常年受火舌舔舐，具有奇妙的抗性。
UI_RelicIcon_15009_3,15009,en,Tiara of Flame,"A tiara worn by those tasked with offering sacrifices in ancient times. After being subjected to the dancing sacrificial flames year in and year out, it possesses remarkable resistance."
UI_RelicIcon_15009_3,15009,ja,火祭りの冠,大昔の時代の司祭が使用していた冠。長年火に焼かれていたため、不思議な耐性を持っている。
UI_RelicIcon_15009_3,15009,ko,제화의 관,옛날 옛적에 사제를 지낸 사람이 쓰던 예관(禮冠). 오랫동안 불의 단련을 받아 기묘한 내성이 생겼다
UI_RelicIcon_15005_1,15005,zh,降雷的凶兆,丽莎专用
UI_RelicIcon_15005_2,15005,zh,雷灾的孑遗,丽莎专用
UI_RelicIcon_15005_3,15005,zh,唤雷的头冠,菲谢尔专用
UI_RelicIcon_15005_4,15005,zh,雷鸟的怜悯,菲谢尔专用
UI_RelicIcon_15005_5,15005,zh,雷霆的时计,菲谢尔专用
UI_RelicIcon_15005_1,15005,en,Omen of Thunderstorm,""
UI_RelicIcon_15005_2,15005,en,Survivor of Catastrophe,""
UI_RelicIcon_15005_3,15005,en,Thunder Summoner's Crown,""
UI_RelicIcon_15005_4,15005,en,Thunderbird's Mercy,""
UI_RelicIcon_15005_5,15005,en,Hourglass of Thunder,""
UI_RelicIcon_15005_1,15005,ja,落雷の前兆,""
UI_RelicIcon_15005_2,15005,ja,雷災の生存者,""
UI_RelicIcon_15005_3,15005,ja,雷を呼ぶ冠,""
UI_RelicIcon_15005_4,15005,ja,雷鳥の憐み,""
UI_RelicIcon_15005_5,15005,ja,雷霆の時計,""
UI_RelicIcon_15005_1,15005,ko,낙뢰의 흉조,""
UI_RelicIcon_15005_2,15005,ko,번개 재앙의 생존자,""
UI_RelicIcon_15005_3,15005,ko,번개를 부르는 모자,""
UI_RelicIcon_15005_4,15005,ko,뇌조의 연민,""
UI_RelicIcon_15005_5,15005,ko,뇌정의 시계,""
UI_RelicIcon_14003_1,14003,zh,渡火者的醒悟,传说中是能耐流火高热的杯盏，如今其中空无一物仅有余温。
UI_RelicIcon_14003_2,14003,zh,渡火者的解脱,浴火的孤高之鸟的羽毛，似乎能从中听到野火里的振翅之声。
UI_RelicIcon_14003_3,14003,zh,渡火者的智慧,渡过火海的智者之冠，曾经映照着在热浪中挺立的古老身影。
UI_RelicIcon_14003_4,14003,zh,渡火者的决绝,在烈焰的簇拥下盛开的花朵，传说古代智者佩着它走进了火海。
UI_RelicIcon_14003_5,14003,zh,渡火者的煎熬,流淌着闪烁热砂的沙漏。流沙匆匆而去，从不留下任何烙印。
UI_RelicIcon_14003_1,14003,en,Lavawalker's Epiphany,A legendary goblet that can withstand extremely high temperatures. It still retains a degree of warmth even though it is now empty.
UI_RelicIcon_14003_2,14003,en,Lavawalker's Salvation,The feather of a proud phoenix. You can almost hear the sound of its wings flapping in the scorching flames.
UI_RelicIcon_14003_3,14003,en,Lavawalker's Wisdom,The circlet of a sage who traversed a sea of fire. It once shone brightly from their ancient silhouette as they stood strong amidst the flames.
UI_RelicIcon_14003_4,14003,en,Lavawalker's Resolution,"A flower that blooms amidst burning flames. It is said that long ago, a sage once wore it as he walked into a sea of fire."
UI_RelicIcon_14003_5,14003,en,Lavawalker's Torment,"Burning sand flows within this hourglass. Despite the intense heat, the sand leave no mark upon the vessel that houses it."
UI_RelicIcon_14003_1,14003,ja,火渡りの悟り,流火の高熱を耐えるコップ、何が入っていなくてもその熱さを感じられる。
UI_RelicIcon_14003_2,14003,ja,火渡りの解放,火を浴びる孤高な鳥の羽根、炎の中で羽ばたく音が聞こえる。
UI_RelicIcon_14003_3,14003,ja,火渡りの知恵,火の海を渡った賢者の冠、熱い浪の中に立つ古い姿を映したものである。
UI_RelicIcon_14003_4,14003,ja,火渡りの堅実,烈火の中で咲く花、古代の知者はそれをつけて火の海に入ったらしい。
UI_RelicIcon_14003_5,14003,ja,火渡りの苦しみ,光る熱砂が流れる砂時計。砂は流れていき、何の烙印も残さない。
UI_RelicIcon_14003_1,14003,ko,불 위를 걷는 자의 깨달음,전설에 의하면 흐르는 불과 초고온의 열기를 버틴다는 잔. 오늘날에는 오직 잔열만 남아있다
UI_RelicIcon_14003_2,14003,ko,불 위를 걷는 자의 해탈,불속을 나는 고고한 새의 깃털. 들판을 태우는 불속에서 날갯짓하는 소리가 들리는 것만 같다
UI_RelicIcon_14003_3,14003,ko,불 위를 걷는 자의 지혜,불타는 바다를 가로질렀던 현자의 모자. 과거에 열기의 파도 속에서 우뚝 서있는 고대인의 모습을 비춘 적 있다
UI_RelicIcon_14003_4,14003,ko,불 위를 걷는 자의 결단,뜨겁게 타오르는 화염 속에서 피어나는 꽃. 전설에 의하면 고대의 현자가 이를 착용한 채 불바다에 걸어들어갔다고 한다
UI_RelicIcon_14003_5,14003,ko,불 위를 걷는 자의 시련,반짝이는 뜨거운 모래가 들어있는 모래시계. 흘러내리는 모래는 어떠한 흔적도 남기지 않는다
UI_RelicIcon_15023_1,15023,zh,结契之刻,古老的晶砂之杯，似乎未尝被岁月磨洗暗淡。
UI_RelicIcon_15023_2,15023,zh,潜光片羽,一片光泽暗淡的翎羽，凝聚着浓重的记忆。
UI_RelicIcon_15023_3,15023,zh,虺雷之姿,据称是山民为夜叉所打造的头冠，外观古朴，但其表面光亮不失润泽。
UI_RelicIcon_15023_4,15023,zh,生灵之华,古老的纪念物，恰如数百年前将它保存的生灵一般鲜活。
UI_RelicIcon_15023_5,15023,zh,阳辔之遗,外观坚实的古代时计，有着晶砂的光泽。
UI_RelicIcon_15023_1,15023,en,Moment of the Pact,An old cup made of sand crystal. Its luster is somehow undimmed by age.
UI_RelicIcon_15023_2,15023,en,Feather of Nascent Light,A dimly lustrous pinion steeped in strong memories.
UI_RelicIcon_15023_3,15023,en,Thundering Poise,"This mask is said to have been made by the mountain people for a Yaksha. It is of simple make, but its surface still shines brightly nonetheless."
UI_RelicIcon_15023_4,15023,en,Flowering Life,An ancient memento. It still looks as alive as the being that preserved it several centuries ago.
UI_RelicIcon_15023_5,15023,en,Solar Relic,An ancient timepiece with a mighty solid look. Its luster is produced by sand crystal.
UI_RelicIcon_15023_1,15023,ja,契約の時,いにしえの晶砂の杯。歳月の侵食を受けてもなお、まだ色褪せてはいないようだ。
UI_RelicIcon_15023_2,15023,ja,潜光の羽,薄暗い質感を持った羽。重々しい記憶を秘めている。
UI_RelicIcon_15023_3,15023,ja,虺雷の姿,山民が夜叉のために作ったと言われる冠。古朴な見た目だが、光沢があり艶やかである。
UI_RelicIcon_15023_4,15023,ja,生霊の華,いにしえの時を思い起こす品。まるで数百年前に保存された生霊のごとく生気を放っている。
UI_RelicIcon_15023_5,15023,ja,陽轡の遺品,頑丈な見た目をした古代の時計。晶砂の光沢が特徴的。
UI_RelicIcon_15023_1,15023,ko,계약의 순간,유리 결정으로 만든 오래된 잔. 광택은 세월의 시련을 이겨낸 듯하다
UI_RelicIcon_15023_2,15023,ko,숨겨진 빛의 깃털,"어슴푸레한 빛깔의 깃털, 농후한 기억이 응축되어 있다"
UI_RelicIcon_15023_3,15023,ko,번개의 자태,산골 주민이 야차를 위해 만든 모자라고 한다. 수수한 외관이지만 표면에는 윤기가 흐른다
UI_RelicIcon_15023_4,15023,ko,생령의 꽃,"오래된 기념물, 수백 년 전에 이 꽃을 보존했던 생령처럼 생기가 넘친다"
UI_RelicIcon_15023_5,15023,ko,태양의 유물,"외관이 튼실한 고대 시계, 유리 모래 같은 광택이 느껴진다"
UI_RelicIcon_15028_1,15028,zh,守秘的魔瓶,紫色水晶雕成的小瓶，被祖母绿的瓶盖紧紧封装着。
UI_RelicIcon_15028_2,15028,zh,谢落的筵席,早已绝迹的鸟类留下的羽毛，被古代花神的信徒镶嵌了亮丽的黄金与宝石。
UI_RelicIcon_15028_3,15028,zh,紫晶的花冠,镶嵌着紫水晶与祖母绿的冠冕，似乎是古代花神祭司的头饰。
UI_RelicIcon_15028_4,15028,zh,月女的华彩,精雕细琢的紫水晶之花，其形态描摹了一种近乎绝迹的古代花朵。
UI_RelicIcon_15028_5,15028,zh,凝结的时刻,不再流动的沙漏，无论如何颠倒，都不再回应时间的流动。
UI_RelicIcon_15028_1,15028,en,Secret-Keeper's Magic Bottle,A small bottle made of purple crystal. An emerald cap keeps it tightly sealed.
UI_RelicIcon_15028_2,15028,en,Wilting Feast,A feather left behind by a long-extinct bird species. It was inlaid with gold and gems by the ancient adherents of the Goddess of Flowers.
UI_RelicIcon_15028_3,15028,en,Amethyst Crown,A crown inlaid with amethyst and emerald. It seems to have been the headgear worn by ancient priests of the Goddess of Flowers.
UI_RelicIcon_15028_4,15028,en,Ay-Khanoum's Myriad,"An amethyst bloom that has been beautifully sculpted in the image of an ancient, extinct flower."
UI_RelicIcon_15028_5,15028,en,A Moment Congealed,"These sands no longer move no matter how you tilt the hourglass, now and forever defying the drift of time itself."
UI_RelicIcon_15028_1,15028,ja,守秘の魔瓶,紫色の水晶から彫られた小さな瓶。エメラルドの蓋によりしっかりと密封されている。
UI_RelicIcon_15028_2,15028,ja,落謝の宴席,遠い昔に絶滅した鳥が残した羽。古代の花神の信者によって、華やかな黄金と宝石があしらわれた。
UI_RelicIcon_15028_3,15028,ja,紫晶の花冠,紫水晶とエメラルドが散りばめられている冠。古代の花神の祭司が身につけていた髪飾りのようだ。
UI_RelicIcon_15028_4,15028,ja,月娘の華彩,精巧に彫られた紫水晶の花。今はもうほとんど絶滅してしまった古代の花を模している。
UI_RelicIcon_15028_5,15028,ja,凝結の刹那,砂が流れなくなった砂時計。いくら逆さまにしても、時間は流れない。
UI_RelicIcon_15028_1,15028,ko,비밀을 지키는 요술병,보랏빛 수정으로 만든 작은 병. 에메랄드 뚜껑으로 단단하게 밀봉되어 있다
UI_RelicIcon_15028_2,15028,ko,시들어버린 연회,오래전에 멸종한 새가 남긴 깃털. 고대 꽃의 신의 신도에 의해 황금과 보석으로 화려하게 장식되었다
UI_RelicIcon_15028_3,15028,ko,자수정 화관,자수정과 에메랄드가 박혀 있는 왕관. 고대 꽃의 신의 제사장이 착용했던 장신구로 보인다
