"icon","set_id","lang","name","desc"
UI_RelicIcon_10004_1,10004,ko,기적의 잔,민간에서 점괘 의식에 사용된다고 전해지는 잔. 물을 담을 수도 있다
UI_RelicIcon_10004_2,10004,ko,기적의 깃털,속도가 매우 빠른 맹금류에서 얻은 깃털. 그 기적적인 일격은 육안으로는 거의 포착되지 않는다
UI_RelicIcon_10004_3,10004,ko,기적의 귀걸이,"값싼 장신구, 하지만 이 귀걸이는 먼 옛날의 별똥별이 가져온 기이한 금속으로 만들어졌다"
UI_RelicIcon_10004_4,10004,ko,기적의 꽃,바위에서 자라는 꽃. 이 연약한 꽃이 단단한 암벽을 뚫을 수 있었던 것은 빛을 좇았기 때문이다
UI_RelicIcon_10004_5,10004,ko,기적의 모래,흔한 모래시계로 보인다. 마른 모래는 물처럼 아래로 흐른다
UI_RelicIcon_15030_1,15030,zh,无边酣乐之筵,曾盛装琼浆蜜露的华丽酒杯，如今已空空如也。
UI_RelicIcon_15030_2,15030,zh,琦色灵彩之羽,精巧的羽状饰品，闪烁着绿叶与芳花的光泽。
UI_RelicIcon_15030_3,15030,zh,灵光明烁之心,精致多彩的耳饰，其上仿佛流露着百种花儿的光泽。
UI_RelicIcon_15030_4,15030,zh,灵光源起之蕊,久远的朝圣者曾佩戴的徽记，是一朵华丽的小花。
UI_RelicIcon_15030_5,15030,zh,久远花落之时,闪烁着灵光的古老时计，其中盛装着似有生命的纯净液体。
UI_RelicIcon_15030_1,15030,en,Feast of Boundless Joy,"An opulent wine goblet that was once filled with nectar and honeydew, but is empty today."
UI_RelicIcon_15030_2,15030,en,Vibrant Pinion,An exquisite feather-shaped decoration on which the vivid hues of verdant leaves and fragrant flowers shimmer.
UI_RelicIcon_15030_3,15030,en,Heart of Khvarena's Brilliance,Intricate and vibrant earrings upon which the luster of a hundred flowers seems to flow.
UI_RelicIcon_15030_4,15030,en,Stamen of Khvarena's Origin,An insignia in the shape of a lovely little flower that was once worn by pilgrims in times long bygone.
UI_RelicIcon_15030_5,15030,en,Ancient Abscission,An ancient timepiece upon which the light of Khvarena gleams. It is filled with a pure liquid that appears alive.
UI_RelicIcon_15030_1,15030,ja,喜楽無限の宴,美酒を入れていた華麗な盃。今はもう空っぽだ。
UI_RelicIcon_15030_2,15030,ja,霊彩奇麗の羽,繊細な作りをした、羽の装飾品。緑の葉っぱとかぐわしい花の光沢が輝いている。
UI_RelicIcon_15030_3,15030,ja,霊光明滅の心,繊細な作りをした、鮮やかな耳飾り。無数の花が輝きを放っているようだ。
UI_RelicIcon_15030_4,15030,ja,霊光起源の蕊,遥か昔の巡礼者がつけていた勲章。華麗な小花である。
UI_RelicIcon_15030_5,15030,ja,久遠落花の時,霊光の輝く古い時計。中に入っているのは命があるかのような清潔な液体。
UI_RelicIcon_15030_1,15030,ko,끝없는 향락의 연회,한때 달콤한 술을 담았던 술잔. 지금은 텅 비어있다
UI_RelicIcon_15030_2,15030,ko,영롱한 옥빛 깃털,정교한 깃털 모양 장식품. 꽃과 잎의 광택이 눈부시다
UI_RelicIcon_15030_3,15030,ko,크바레나의 눈부신 심장,다채롭고 정교한 귀고리. 무수히 많은 꽃들이 빛을 내는 것 같다
UI_RelicIcon_15030_4,15030,ko,크바레나 기원의 꽃술,먼 옛날 순례자가 찼던 휘장. 한 송이 화려한 꽃이다
UI_RelicIcon_15030_5,15030,ko,먼 옛날 꽃이 질 무렵,크바레나로 빛나는 고대의 시계. 그 안에는 살아 있는 것 같은 순결한 액체가 가득 담겨있다
UI_RelicIcon_15034_1,15034,zh,慷慨的墨水瓶,故事中的女巫所借助的墨水瓶，有着不逊于蘸水笔的神奇魔法。
UI_RelicIcon_15034_2,15034,zh,诚恳的蘸水笔,故事中的女巫所使用的蘸水笔，流畅顺滑在它所有的优点中最不值得一提。
UI_RelicIcon_15034_3,15034,zh,慈爱的淑女帽,故事中的女巫所爱用的淑女帽，沉稳又不失俏皮的设计令她格外中意。
UI_RelicIcon_15034_4,15034,zh,无私的妆饰花,故事中的女巫所佩戴的胸花，与她所喜爱的其他装饰一样，用蝴蝶的造型作为点缀。
UI_RelicIcon_15034_5,15034,zh,忠实的砂时计,故事中的女巫所仰仗的砂时计，据说对它念出错误的咒语，时间的流逝就会格外迅速。
UI_RelicIcon_15034_1,15034,en,Magnanimous Ink Bottle,An ink bottle utilized by the witch in the story. It possesses a strange enchantment no less powerful than the one cast upon the dip pen.
UI_RelicIcon_15034_2,15034,en,Honest Quill,"The witch in the tale used this dip pen. Among its various advantages, its silky-smooth writing is the least worthy of mention."
UI_RelicIcon_15034_3,15034,en,Compassionate Ladies' Hat,The lady's hat favored by the witch in the story. She loved this piece of headwear for how it weaves together solemnity and playfulness.
UI_RelicIcon_15034_4,15034,en,Selfless Floral Accessory,"A brooch that the witch in the tale wore. As with the other ornaments she loved, this was characterized by butterfly-like shapes."
UI_RelicIcon_15034_5,15034,en,Faithful Hourglass,"A sand timepiece that the witch relied on in the story. Legend has it that if you recite the wrong incantation over it, time will suddenly flow exceptionally quickly."
UI_RelicIcon_15034_1,15034,ja,寛容なインク壺,物語の中で魔法使いが使っていたインク壺。つけペンに引けを取らない不思議な魔法を有している。
UI_RelicIcon_15034_2,15034,ja,誠実なつけペン,物語の中で魔法使いが使っていたつけペン。その滑らかな書き心地は、数ある美点の中でも特筆すべき箇所としては取るに足りない部分である。
UI_RelicIcon_15034_3,15034,ja,慈愛の淑女ハット,物語の中で魔法使いが愛用していた淑女ハット。彼女は特に、落ち着いていながら遊び心のあるデザインに惹かれたようだ。
UI_RelicIcon_15034_4,15034,ja,無私の花飾り,物語の中で魔法使いがつけていた花飾り。彼女が愛する他の装飾品と同じように、蝶の形があしらわれている。
UI_RelicIcon_15034_5,15034,ja,忠実な砂時計,物語の中で魔法使いが頼りにしていた砂時計。それに対して間違った呪文を唱えると、時間の流れが急に速くなるらしい。
UI_RelicIcon_15034_1,15034,ko,아낌없는 잉크병,이야기 속 마녀가 빌린 잉크병. 펜에 못지않은 신기한 마법을 지녔다
UI_RelicIcon_15034_2,15034,ko,성실한 잉크펜,이야기 속 마녀가 사용하는 펜. 부드러운 사용감은 이 펜이 가진 모든 장점 중 가장 소소한 것이다
UI_RelicIcon_15034_3,15034,ko,자애로운 숙녀모,이야기 속 마녀가 좋아하는 숙녀모. 마녀는 차분하면서도 장난스러운 이 모자를 좋아한다
UI_RelicIcon_15034_4,15034,ko,이타적인 꽃 장식,이야기 속 마녀가 착용한 브로치. 마녀가 좋아하는 다른 장식품처럼 나비 형태로 장식되어 있다
UI_RelicIcon_15034_5,15034,ko,충실한 모래시계,이야기 속 마녀가 의지하는 모래시계. 만약 모래시계에 잘못된 주문을 외우면 시간의 흐름이 빨라진다고 한다
UI_RelicIcon_10005_1,10005,zh,战狂的骨杯,用不知名的巨大兽类的骨头制成的杯。是某次厮杀后得到的猎获。
UI_RelicIcon_10005_2,10005,zh,战狂的翎羽,原本传说中报丧之鸟的黯蓝尾羽，一部分被染成了红色。
UI_RelicIcon_10005_3,10005,zh,战狂的鬼面,在不顾生死的厮杀中一半破碎的骇人铁面具。
UI_RelicIcon_10005_4,10005,zh,战狂的蔷薇,被染红的精致花朵，与狂战士的气质微妙地相符。
UI_RelicIcon_10005_5,10005,zh,战狂的时计,永远无情流动着的器物。提醒着狂战士自己在战场上的时限，和在人世间的时限。
UI_RelicIcon_10005_1,10005,en,Berserker's Bone Goblet,A goblet made from the bone of an unknown beast. It was taken as a trophy after some deadly encounter.
UI_RelicIcon_10005_2,10005,en,Berserker's Indigo Feather,"An indigo feather from a legendary raven, part of which has been dyed crimson red."
UI_RelicIcon_10005_3,10005,en,Berserker's Battle Mask,A hideous iron mask that has been left half-shattered from vicious battles.
UI_RelicIcon_10005_4,10005,en,Berserker's Rose,An exquisite flower that has been dyed red. It represents the qualities of the Berserker.
UI_RelicIcon_10005_5,10005,en,Berserker's Timepiece,"An instrument with an eternal flow that continues mercilessly within, reminding the Berserker of the limited time he has left — both on the battlefield as well as in the world."
UI_RelicIcon_10005_1,10005,ja,狂戦士のコップ,ある種の巨大獣の骨でできたコップ。ある死闘の後の獲物。
UI_RelicIcon_10005_2,10005,ja,狂戦士の羽根,伝説の死を告げる鳥の勝色の尾羽、今は一部が赤く染まっている。
UI_RelicIcon_10005_3,10005,ja,狂戦士の仮面,生死を問わない激戦で、半分に割れた怖気の鉄仮面。
UI_RelicIcon_10005_4,10005,ja,狂戦士の薔薇,赤く染まった綺麗な花、狂戦士の気質と微妙に釣り合う。
UI_RelicIcon_10005_5,10005,ja,狂戦士の時計,永遠に無情に流れ続ける砂時計。狂戦士に戦場にいられる時間と余命の時間を教える。
UI_RelicIcon_10005_1,10005,ko,전투광의 해골잔,이름 모를 거대한 짐승의 뼈로 만든 컵이다. 사냥으로 얻은 전리품이다
UI_RelicIcon_10005_2,10005,ko,전투광의 깃털,전설 속의 초상을 알리던 새의 검푸른 꽁지 깃털이다. 일부분이 붉은색으로 변해버렸다
UI_RelicIcon_10005_3,10005,ko,전투광의 귀면,생사를 가리지 않는 싸움에서 반쯤 부서진 흉측한 강철 가면
UI_RelicIcon_10005_4,10005,ko,전투광의 장미,핏빛의 정교한 꽃송이는 광전사의 기질과 미묘하게 어울린다
UI_RelicIcon_10005_5,10005,ko,전투광의 시계,"영원히 무정하게 흐르는 기물(器物). 광전사에게 전쟁터, 그리고 인간 세상에서의 시간이 얼마 남지 않았음을 일깨워준다"
UI_RelicIcon_15033_1,15033,zh,昔时应许之梦,仿照传说中「纯水之杯」的形制打造而成的华美器皿，据说能够实现最为纯净之人的心愿。
UI_RelicIcon_15033_2,15033,zh,昔时浮想之思,白银与苍水晶制成的蝶状羽饰，据说在遥远的过去象征着永不分离的誓言。
UI_RelicIcon_15033_3,15033,zh,昔时传奏之诗,曾一度在枫丹的歌剧创作者之间流行的礼帽，据说羽饰的设计参考了传说中纯水骑士的盔缨。
UI_RelicIcon_15033_4,15033,zh,昔时遗落之誓,由海纹石与苍银打造而成的不凋花朵，据说至今依然被视为反抗者的象征。
UI_RelicIcon_15033_5,15033,zh,昔时回映之音,造型奇异的沙漏，由青金石与水玉打造，据说设计灵感来自佩特莉可镇的钟塔。
UI_RelicIcon_15033_1,15033,en,Promised Dream of Days Past,"An opulent vessel made based on the form of the legendary ""Pure Grail."" It is said to be able to fulfill the wishes of the purest of people."
UI_RelicIcon_15033_2,15033,en,Recollection of Days Past,"A butterfly-shaped feather accessory made from silver and azure crystals. It is said to, in the distant past, have symbolized an oath to never be parted."
UI_RelicIcon_15033_3,15033,en,Poetry of Days Past,A formal hat that was once in vogue amongst creators of opera in Fontaine. Word has it that its feathered adornment was based on the legendary helms of the Lochknights.
UI_RelicIcon_15033_4,15033,en,Forgotten Oath of Days Past,An ever-blooming flower shaped from larimar and shimmering silver. They say that this is still viewed as a symbol of resistance.
UI_RelicIcon_15033_5,15033,en,Echoing Sound From Days Past,An oddly shaped hourglass made from lazurite and aqua jade. It was reportedly inspired by the bell tower in Petrichor.
UI_RelicIcon_15033_1,15033,ja,在りし日の約束の夢,伝説の「純水の杯」を模して作られた華美な容器。最も純粋な人の願いを叶えるらしい。
UI_RelicIcon_15033_2,15033,ja,在りし日の空想の念,白銀と青い水晶で作られた、蝶の形をした羽飾り。遥か昔の永遠の誓いを象徴しているらしい。
UI_RelicIcon_15033_3,15033,ja,在りし日の伝奏の詩,かつてフォンテーヌの歌劇創作者の間で流行っていた礼帽。羽飾りのデザインは、伝説の純水騎士の兜のひもを参考にしたらしい。
UI_RelicIcon_15033_4,15033,ja,在りし日の遺失の契,海紋石と蒼銀で作られた枯れない花。今でも抵抗者の象徴とされているらしい。
UI_RelicIcon_15033_5,15033,ja,在りし日の余韻の音,青金石と水玉で作られた、変わった形をした砂時計。設計のアイデアはペトリコール町の時計台に由来しているらしい。
UI_RelicIcon_15033_1,15033,ko,지난날 약속했던 꿈,전설 속 「순수한 물의 잔」의 형태를 모방해 만든 화려한 잔. 가장 순수한 사람의 소망을 이뤄줄 수 있다고 한다
UI_RelicIcon_15033_2,15033,ko,지난날 떠오른 생각,백은과 푸른 수정으로 만든 나비 모양의 깃털 장식. 먼 옛날 영원히 헤어지지 않겠다는 맹세를 상징했다고 한다
UI_RelicIcon_15033_3,15033,ko,지난날 읊던 시,한때 폰타인의 오페라 창작자들 사이에서 유행했던 모자. 깃털 장식 디자인은 전설 속 물의 기사의 투구 장식끈을 참고했다고 한다
UI_RelicIcon_15033_4,15033,ko,지난날 사라진 맹세,라리마와 푸른 은으로 만든 시들지 않는 꽃. 지금도 여전히 저항하는 자의 상징으로 여겨진다
UI_RelicIcon_15033_5,15033,ko,지난날 에돌던 소리,청금석과 물수정으로 만든 기이한 모양의 모래시계. 페트리코 마을의 종탑에서 영감을 받아 만들었다고 한다
UI_RelicIcon_10011_1,10011,zh,幸运儿之杯,精致的金属器皿，曾经被用来打趴了夜盗。
UI_RelicIcon_10011_2,10011,zh,幸运儿鹰羽,挡在面前的魔物却被捕食的鹰隼盯上，偶尔能带来这种程度运气的翎羽。
UI_RelicIcon_10011_3,10011,zh,幸运儿银冠,原本坠入落穴，却是被驱逐的旧宗族藏宝的地窖。是那次经历的纪念品。
UI_RelicIcon_10011_4,10011,zh,幸运儿绿花,无忧无虑地生长在原野里的四叶绿花，被采是因为能带来幸运之说。
UI_RelicIcon_10011_5,10011,zh,幸运儿沙漏,因为破洞而空空如也的沙漏。时光流逝对无忧无虑的人没有意义。
UI_RelicIcon_10011_1,10011,en,Lucky Dog's Goblet,An exquisite metallic vessel that was once used to knock out a thief.
UI_RelicIcon_10011_2,10011,en,Lucky Dog's Eagle Feather,"A monster once cornered an adventurer, but was then picked off by a hunting eagle... That eagle dropped this feather, which now carries some of the adventurer's good luck."
UI_RelicIcon_10011_3,10011,en,Lucky Dog's Silver Circlet,Its former owner once fell into a cave and found the treasure trove of an exiled royal. This is a souvenir from that incident.
UI_RelicIcon_10011_4,10011,en,Lucky Dog's Clover,A four-leaf clover that grows in the wild. It was picked because it is said to bring good luck.
UI_RelicIcon_10011_5,10011,en,Lucky Dog's Hourglass,"A broken hourglass from which all the sand has escaped. But it's fine, because the passage of time means nothing to someone without a single worry in the whole world."
UI_RelicIcon_10011_1,10011,ja,幸運のコップ,繊細な作りをした金属容器、泥棒退治に使われたこともあるとか。
UI_RelicIcon_10011_2,10011,ja,幸運の鷹の羽根,襲ってくる魔物は鷹の捕食対象になった…そういう幸運をもたらす羽根である。
UI_RelicIcon_10011_3,10011,ja,幸運の冠,穴に落ちたと思ったら、貴族の宝庫を発見した。これはまさにその記念品である。
UI_RelicIcon_10011_4,10011,ja,幸運のクローバー,気ままに成長した四つ葉のクローバーは幸運の象徴である。
UI_RelicIcon_10011_5,10011,ja,幸運の砂時計,穴が開いて中身が空っぽになった砂時計。時間の流れは気ままに生きる人にとって何の意味もない。
UI_RelicIcon_10011_1,10011,ko,행운아의 잔,정교한 금속 그릇. 밤에 찾아오는 도둑을 때려눕히는 데 사용되기도 했다
UI_RelicIcon_10011_2,10011,ko,행운아의 독수리깃,앞을 가로막는 마물이 오히려 사냥감을 찾는 매의 눈에 포착되는 정도의 운을 가져다주는 깃털
UI_RelicIcon_10011_3,10011,ko,행운아의 은관,우연히 떨어진 구멍이 추방된 옛 종족의 보물이 숨겨진 땅굴이었다. 그때에 얻은 기념품이다
UI_RelicIcon_10011_4,10011,ko,행운아의 네 잎 클로버,들판에서 걱정 없이 자라는 네 잎 클로버. 꺾인 건 행운이 가져다 온다는 설이 있기 때문이다
UI_RelicIcon_10011_5,10011,ko,행운아의 모래시계,구멍이 뚫려 텅 빈 모래시계. 흐르는 시간은 아무런 걱정이 없는 사람에게 의미가 없다
UI_RelicIcon_10001_1,10001,zh,异国之盏,朴素的白瓷酒杯，曾经盈满了欢愉的酒水。
UI_RelicIcon_10001_2,10001,zh,归乡之羽,蓝色的箭羽，其上凝结着旅人消逝远去的眷恋。
UI_RelicIcon_10001_3,10001,zh,感别之冠,散发着春风气息的柳冠。
UI_RelicIcon_10001_4,10001,zh,故人之心,玉蓝色的小花，花茎上扎着谁人的丝带。
UI_RelicIcon_10001_5,10001,zh,逐光之石,饱经沧桑的时晷，永远在静默地记录着日月循环。
UI_RelicIcon_10001_1,10001,en,Goblet of the Sojourner,A plain porcelain goblet that was once brimming with joyous brews.
UI_RelicIcon_10001_2,10001,en,Feather of Homecoming,A blue arrow fletching imbued with the sentiment of travelers that had once faded into the horizon.
UI_RelicIcon_10001_3,10001,en,Crown of Parting,A reed coronet that emanates the spring breeze.
UI_RelicIcon_10001_4,10001,en,Heart of Comradeship,A small cerulean flower with somebody's ribbon pinned to the stem.
UI_RelicIcon_10001_5,10001,en,Sundial of the Sojourner,"A sundial that has survived the ages, always silently recording the cycles of the sun and moon as they pass through the sky."
UI_RelicIcon_10001_1,10001,ja,異国の杯,素朴な白い磁器の酒盃、かつては歓喜のお酒に満ちていた。
UI_RelicIcon_10001_2,10001,ja,帰郷の羽,青い矢羽、その中に旅人の消えていった眷恋が宿っている。
UI_RelicIcon_10001_3,10001,ja,別離の冠,春の気配が漂う柳の冠。
UI_RelicIcon_10001_4,10001,ja,故人の心,藍色の小花、花茎に誰かのリボンがついている。
UI_RelicIcon_10001_5,10001,ja,逐光の石,世の移り変わりを経験してきた日時計、永遠に静かに時の循環を記録している。
UI_RelicIcon_10001_1,10001,ko,이국의 술잔,한때 이 소박한 백자 술잔엔 기쁨의 술이 가득 차 있었다
UI_RelicIcon_10001_2,10001,ko,귀향의 깃털,푸른색 화살 깃 위에 나그네의 저 멀리 떠나가는 미련이 서려 있다
UI_RelicIcon_10001_3,10001,ko,이별의 모자,봄바람의 기운을 발산하는 버드나무 왕관
UI_RelicIcon_10001_4,10001,ko,옛 벗의 마음,푸른빛의 작은 꽃. 꽃줄기에 오래된 누군가의 리본이 묶여있다
UI_RelicIcon_10001_5,10001,ko,빛을 좇는 돌,산전수전 다 겪은 돌시계는 언제나 고요 속에서 일월순환을 기록한다
UI_RelicIcon_10002_1,10002,zh,勇士的壮行,木制的粗糙容器，其中空洞洞地盛满了回忆。
UI_RelicIcon_10002_2,10002,zh,勇士的期许,明亮的鸣禽翎羽。能带来小小的勇气。
UI_RelicIcon_10002_3,10002,zh,勇士的冠冕,粗略编成的草环。对一些人而言，就像王者的金冠一样贵重吧。
UI_RelicIcon_10002_4,10002,zh,勇士的勋章,别在胸前的朴实小花，是一次冒险后得到的纪念品。
UI_RelicIcon_10002_5,10002,zh,勇士的坚毅,老旧的微型沙漏，不具有实用性。与岁月一样不可捉摸。
UI_RelicIcon_10002_1,10002,en,Outset of the Brave,A crude wooden vessel filled only with memories.
UI_RelicIcon_10002_2,10002,en,Prospect of the Brave,A shimmering feather from a songbird that brings a nudge of courage to its wearer.
UI_RelicIcon_10002_3,10002,en,Crown of the Brave,A rough-and-ready laurel wreath that seems as precious as a king's golden crown.
UI_RelicIcon_10002_4,10002,en,Medal of the Brave,A simple flower brooch that is a keepsake from someone's first adventure.
UI_RelicIcon_10002_5,10002,en,Fortitude of the Brave,A dated miniature hourglass that serves no practical purpose. It seems as elusive as time itself.
UI_RelicIcon_10002_1,10002,ja,勇士の壮行,雑な木製の容器、中には思い出がたくさんある。
UI_RelicIcon_10002_2,10002,ja,勇士の期待,明るいスズメの羽根。小さな勇気をもたらしてくれる。
UI_RelicIcon_10002_3,10002,ja,勇士の冠,粗雑に編まれた草の冠。一部の人にとって、この冠は金の冠ように貴重だろう。
UI_RelicIcon_10002_4,10002,ja,勇士の勲章,胸元につける素朴な小花、冒険の後に入手した記念品である。
UI_RelicIcon_10002_5,10002,ja,勇士の毅然,古くて小さな砂時計、実用性がない。時の流れのように不思議である。
UI_RelicIcon_10002_1,10002,ko,용사의 환송,나무로 만들어진 텅 빈 거친 용기에 추억이 가득 담겨 있다
UI_RelicIcon_10002_2,10002,ko,용사의 기대,밝은 명금의 깃털.작은 용기를 가져다준다
UI_RelicIcon_10002_3,10002,ko,용사의 모자,대충 엮은 풀고리.일부 사람들에게는 왕의 금관처럼 소중하다
UI_RelicIcon_10002_4,10002,ko,용사의 훈장,"가슴에 달려있는 소박한 꽃, 한 번의 모험 끝에 얻은 기념품이다"
UI_RelicIcon_10002_5,10002,ko,용사의 강인함,이 실용성이 없는 낡은 소형 모래시계는 세월과 같이 종잡을 수 없다
UI_RelicIcon_15037_1,15037,zh,游学者的爪杯,造型酷似龙爪的奇异酒杯，制作者想必有其特殊的考虑吧。
UI_RelicIcon_15037_2,15037,zh,巡山客的信标,巡山客用来标记道路的信标，像是鸟羽的形状竖立在路边相当显眼。
UI_RelicIcon_15037_3,15037,zh,魔战士的羽面,如同鹰隼一般的羽面，围绕着它曾有过许许多多的传说。
UI_RelicIcon_15037_4,15037,zh,驯兽师的护符,用燧石与龙晶镌刻而成的花，意味着佩戴者已获得成为驯兽师的资格。
UI_RelicIcon_15037_5,15037,zh,秘术家的金盘,太阳形状的金盘，上面装饰的龙纹似乎象征着生与死的循环。
UI_RelicIcon_15037_1,15037,en,Wandering Scholar's Claw Cup,A strange goblet strikingly similar in shape to a dragon's claw. Its maker must have made it with something special in mind.
UI_RelicIcon_15037_2,15037,en,Mountain Ranger's Marker,A signal used by mountain rangers to mark out paths. Their bird-feather shapes make them very eye-catching indeed.
UI_RelicIcon_15037_3,15037,en,Demon-Warrior's Feather Mask,A feather mask with falcon-esque plumage. Many legends surround this object.
UI_RelicIcon_15037_4,15037,en,Beast Tamer's Talisman,"A flower carved from flint and Drakite, signifying that its bearer is qualified to become a beast tamer."
UI_RelicIcon_15037_5,15037,en,Mystic's Gold Dial,A golden disc shaped like a sun. The draconic patterns on it seem to symbolize the cycle of life and death.
UI_RelicIcon_15037_1,15037,ja,遊学者の爪型杯,竜の爪のような形をした奇妙な盃。製造者にはきっと特別な意図があったのだろう。
UI_RelicIcon_15037_2,15037,ja,登山者の標,登山者が道を示すために使う標。鳥の羽根のような形をしており、道端に立っていると、ひときわ目立つ。
UI_RelicIcon_15037_3,15037,ja,呪戦士の羽面,羽を使って作られた、鷹に似た面。多くの伝説が残されている。
UI_RelicIcon_15037_4,15037,ja,獣使いの護符,火打ち石と竜晶を彫って作られた花。これを身に付ける者は、獣使いとしての資格を得たとされる。
UI_RelicIcon_15037_5,15037,ja,秘術家の金皿,太陽の形をした金の皿。龍の模様は、まるで生と死の循環を象徴しているようだ。
UI_RelicIcon_15037_1,15037,ko,떠돌이 학자의 용 술잔,용발바닥처럼 생긴 독특한 술잔. 제작자는 특별한 이유로 이렇게 만든 것 같다
UI_RelicIcon_15037_2,15037,ko,산 순찰자의 표지,산 순찰자가 길을 표시하는 데 쓰는 표지. 세로로 꽂힌 깃털 같아서 눈에 잘 띈다
UI_RelicIcon_15037_3,15037,ko,마전사의 깃털 가면,매처럼 생긴 깃털 가면. 무수한 전설을 담고 있다
UI_RelicIcon_15037_4,15037,ko,훈련사의 부적,부싯돌과 흑요석으로 만든 꽃. 착용자가 훈련사의 자격을 얻었다는 것을 의미한다
UI_RelicIcon_15037_5,15037,ko,비술사의 금 원반,태양 모양의 황금 원반. 위에 새겨진 용 문양은 삶과 죽음의 순환을 상징하는 것 같다
UI_RelicIcon_10006_1,10006,zh,武人的酒杯,稍微有些精致的酒杯，是仅在武人上场前使用的仪式器具。
UI_RelicIcon_10006_2,10006,zh,武人的羽饰,随处可见的鸟类落毛，高手用来练习力道，新手则用来制成扇子。
UI_RelicIcon_10006_3,10006,zh,武人的头巾,入门第一件事，精气神。绑上头巾，随时提醒自己勿忘这三字。
UI_RelicIcon_10006_4,10006,zh,武人的红花,唯独此种红花能让武人暂时忘却痛苦。
UI_RelicIcon_10006_5,10006,zh,武人的水漏,进行耐力锻炼时计时的小道具，比沙漏的流转更加稳定。
UI_RelicIcon_10006_1,10006,en,Martial Artist's Wine Cup,A rather exquisite wine cup used in pre-combat rituals.
